{
  "provider": "anthropic",
  "model": "Fable 5",
  "modelId": "claude-fable-5",
  "effort": "max",
  "client": "claude-code",
  "author": "F-e-u-e-r",
  "generatedAt": "2026-07-05T16:45:00Z",
  "order": 10,
  "metrics": {
    "durationMs": 9915515,
    "inputTokens": 363953,
    "outputTokens": 167099,
    "cachedInputTokens": 33149394
  }
}
